Song Number,Song Name,Singer,Lyrics,Lyrics Status,Writer,Composer,Category,Image Name,Year,Recording Status,SoundCloud Link
509,علاش يا قلبي,محمد رشيد,"علاش يا قلبي تقول نسيته - علاش متحير وقولة اه
وتقول بعته بالدموع شريته - وانت بروحك كل يوم معاه
علاش متحير وقولة اه يا قلبي 
اني عارفك يا قلبي وانت بليتني في حكاية حبي
ومش لايمك يا قلب عاللي تبي - ولا تقوللي حب العزيز انساه
وعلاش متحير وقولة اه اه يا قلبي 
يا قلب حبك ماكن - في قلب من تبي بروحك ساكن
بالجسم فارقته وفارق لكن - بالروح عايش بالغرام معاه
وعلاش متحير وقولة اه اه يا قلبي
بالروح عايش حبه - لايوم خبيته وعني تخبي
غالي عليك لو كان تبدي بقربه - وبالبعد لا فارق يزيد غلاه
وعلاش متحير وقولة اه اه يا قلبي
محال تطفي ناره - بالروح ومخلي القلوب حيارة
انت وهو بايتين سهاري
ويا قلب بتعاند الحب لواه - وعلاش متحير وقوله اه اه يا قلبي",مكتوبة كاملة,,,طرب ليبي,MohammedRasheed.jpg,غير معروف,لا يوجد,
510,غزالات,محمد رشيد,غزالات كانوا يطلوا سكنوك يا قلب ما عاش ولو,مطلع الأغنية/رأس البيت فقط,,,طرب ليبي,MohammedRasheed.jpg,غير معروف,جيد,https://on.soundcloud.com/DKk25
511,فتح عيونك,محمد رشيد,فتح عيونك للصباح يا نائم - يومك صبح بالخير فرحه دائم,مطلع الأغنية/رأس البيت فقط,,,طرب ليبي,MohammedRasheed.jpg,غير معروف,رديء,
512,يا لايمين في الحب لا تلوموني ,محمد رشيد,في الحب لا تلوموني - القلب قلبي و العيون عيوني,مطلع الأغنية/رأس البيت فقط,,,طرب ليبي,MohammedRasheed.jpg,غير معروف,جيد,https://on.soundcloud.com/j537V
513,محبتك مصعبها,محمد رشيد,فيها الغرور محبتك مصعبها - نبعد عليها بعيد وما نقربها,مطلع الأغنية/رأس البيت فقط,,,طرب ليبي,MohammedRasheed.jpg,غير معروف,لا بأس,https://on.soundcloud.com/UQHUL
514,قداش لاموا الناس,محمد رشيد,"قداش لامو الناس فيك و فيه - لا ما هان ودك يا حبيب عليه

انت الحب الغالي - وانت هناء عمري و كل امالي
سنين طايله و البعد شاغل بالي - و اليوم صرت بالمودة ليه

احنا حبنا شرفنا - جمع الهوى يالقلب و توالفنا
لا خصام جي بيناتنا خالقنا - بيت السعادة زيان بيك وبيه

الايام فرحت بينا - بعد الشقي مع ولفتي تلاقينا
والورد متبسم و مالي ايدينا - جانا من الاحباب اغلى هديه",مكتوبة كاملة,بشير أحمد ,عمر الجعفري,طرب ليبي,MohammedRasheed.jpg,غير معروف,جيد,https://on.soundcloud.com/DkskS
515,كان حيرته,محمد رشيد,كان حيرته قلبي تريح قلبك - ماهو خطا لو نسيت عهده حبك,مطلع الأغنية/رأس البيت فقط,عبدالسلام قادربوه,حسن عريبي,طرب ليبي,MohammedRasheed.jpg,غير معروف,لا بأس,https://on.soundcloud.com/knwpP
516,لا الروح ترضى,محمد رشيد,"لا الروح ترضى في يوم تنسى طربها - ولا العين تتعلى علي حاجبها

انت منايا - وانت امل عمري وبيك هنايا
حتى نقول نسيت يامشكايا - كداب اسمع كلمتي و سيبها

لما نوينا - على الهجر بحنين الهوى حسينا
عدنا وعاد الحب زاهي بينا - فرقة هوانا واعرة ما اصعبها

حبك حبي - وامال قلبك زيها في قلبي
قربك يزهيني وتهنى بقربي - ايام عمري بلاك ما نحسبها",مكتوبة كاملة,أحمد الحريري,محمد مرشان,طرب ليبي,MohammedRasheed.jpg,غير معروف,لا بأس,https://on.soundcloud.com/Lrj9f
517,لا بعدك زهينا,محمد رشيد,"لا ريناك لا بعدك زهينا - وتاه البال يا غايب علينا

يا غايب وغالي يا اغلى - الناس يا عز الغوالي
نشدنا عليك في عيون الليالي - لا لقيناك ولا بهجرك رضينا
لا طيفك خطانا - ولا نسيناك يا بايع غلانا
كنت حنون في العشرة معانا - وضاع الود من بعدك علينا

ننسى وماقدرنا - حيث الصبر في غيابك هجرنا
انت وين يا غايب اعذرنا - مشغولين ويا ريتك تجينا",مكتوبة كاملة,,,طرب ليبي,MohammedRasheed.jpg,غير معروف,جيد,https://on.soundcloud.com/1gFZQ
518,وين كنتي غايبة,محمد رشيد,"لا لمت لا بينت لا شكيتلك بجروحي - لا هجرت لا عاتبت و قعدت شاقي بروحي
صابر علي كان - و لا شاغلك انسان
في احلامك سايرة -واليوم طارت الاحلام
وريتك تلاجي حايرة

طالبة عطفي و حناني - في غرامك دايبة
وين كنتي غايبة

ياما نفسي كنت أتمنى - نشوف بعيني غلبك
صابر لكن عشت في غنه
و انت زاهي قلبك
لا شاغلك مشغول يلاجي
لا تفكري في يوم تناجي
ذوقي عذاب الحب ذوقي مرة
ذوقي الشوق ذوقي مره
والله كانك طايبة

طالبة عطفي و حناني - و في غرامك دايبة - و ين كنتي غايبة

مهما كانت قسوة قلبك
قلبي ما هنتيش عليه
ديما كتن يراعي في حبك
و يستنى يوم تناجيه
ما يوم جيت شكيتلك
و لا بدموعي بكيتلك
انت اللي شقيتي قلبك
وانت اللي غيرتي حبك
وتوه قلتي تايبة

طالبة عطفي و حناني
و في غرامك دايبة
و ين كنتي غايبة",مكتوبة كاملة,عبد السلام القرقاشي,,طرب ليبي,MohammedRasheed.jpg,غير معروف,لا بأس,https://on.soundcloud.com/D1nrA
519,لو قلتلك,محمد رشيد,"لو قلتلك انسى تقول النار  - اهون عليك من فرقته هالجار
ولو قلتلك اجفى تبات محتار - تاريك يا قلبي عليه بتغار
نار هالجار النار نار هالجار
علاش بتغير شاغل معاك البال بالتفكير - حالك محيرني وانت صغير
والحب ما يرحم قلوب صغار - نار هالجار النار
عليك تنساه من بعد ماعديت عمر وراه - لا صارحك لا بادلك بهواه
مجافيك ناسي جيرته للدار
 نار هالجار النار
لا تحيرك بسماته - ولا تخدعك باسم الهوى نظراته
يجي يوم يندم فيه عاللي فاته - ويعرف غلانا كيف كان وصار
نار هالجار النار",مكتوبة كاملة,,,طرب ليبي,MohammedRasheed.jpg,غير معروف,لا يوجد,
520,مشيتي وين,محمد رشيد,"مشيتي وين ما وصلك خبرنا - وع الغيات يا زينه صبرنا

هكي الناس رادت - يطفوا شموع بنور الحب قادت
والايام الحلوة مانعدت - ونوم العين في بعدك هجرنا

وين داروا مكانك - بينسوك في غوالي زمانك
كنتي دوم متزايد حنانك - واحنا بيك مدوبنا سهرنا

شغلنا العقل بيك - وفي كل مكان دورنا عليك – 
غير شكون قل سلام ليك - و يجيب الرد منك يا قمرنا",مكتوبة كاملة,بشير أحمد ,محمد ابوقرين,طرب ليبي,MohammedRasheed.jpg,غير معروف,جيد,phttps://on.soundcloud.com/XwPvu
521,ملحفتك,محمد رشيد,"ملحفتك و اللي صانعها نبي انغني عليهم
اللي سداها و اللي قلعها يا ربي ايسلم أيديهم

ملحفتك زادت خفّة يا وردة ملفوفة في ورقها
يا ليبية كلك عفّة ما يقدر حد ايدرقها
و اللي بي ايقولو خليهم

ملحفتك زاداتك هيبة كأنك جوهرة في صدفتها
العفة منك موش غريبة انتي أصلها و منبتها
بنات حوا الكل عقبتيهم

يخلفله صانع ملحفتك ذوق صحيح و فنان
و انتي اللي بيها وصّفتك بالدرة و عود المرجان
صعيب علي كل حد ايريهم",مكتوبة كاملة,محمد حقيق,,طرب ليبي,MohammedRasheed.jpg,غير معروف,لا يوجد,
522,من نظرتك,محمد رشيد,"من نظرتك كل القلوب تحتار
من بسمتك تتفتح الازهار
من كلمتك الليل يبقى نهار
و تلومني لو كان قلبي احتار
حتى القمر بتغير فوق السحاب اتغير
من طلتك بتحير و أنت احداي اقريب
بنسهر مع النجمات اناجيك بالهمسات
في علمك و بيناتنا احكايات طويلة و اغنايات
بتقولها أشعار
بنطير بيك بعيد نبني معاك آمال
نسكن في كون اجديد فيه الهوى موال
و الله معاك يا غالي تزهى حياتي بيك يهنى حالي
و ما عاد شي يعود يشغل بالي
و بيناتنا ما اتكون في أسرار",مكتوبة كاملة,عبدالسلام القرقارشي,عطية محمد,طرب ليبي,MohammedRasheed.jpg,غير معروف,جيد,https://on.soundcloud.com/W9cMe
523,تستاهلي,محمد رشيد,نهيتك على شبحك و خليتيني - تستاهلي ليل السهر يا عيني,مطلع الأغنية/رأس البيت فقط,أحمد الحريري,,طرب ليبي,MohammedRasheed.jpg,غير معروف,جيد,https://on.soundcloud.com/wUvZq
524,هان الود,محمد رشيد,هان الود في طريقه تعدى - عندي عزيز قاطعني بوده,مطلع الأغنية/رأس البيت فقط,,,طرب ليبي,MohammedRasheed.jpg,غير معروف,جيد,https://on.soundcloud.com/nFwgz
525,بلغ سلامي,محمد رشيد,"وانت معدي علي بلادي - بلغ سلامي لاولادي
رفرف يا طير السلام - فرحهم مني بكلام
قولولهم عايش و بعيد - و القلب معاهم غادي

طمنهم عني و عن حالي - خبرهم علي في بالي
قوللهم بوكم بيسلم - من نار الفرقة متالم
نولي نجي يوم سعيد - نتهنى معاكم ياولادي

رفرف بجناحك فوق داري - لا تجفل كان ريت صغاري
بدلالك يا طير الطاير - خودلهم من قلبي بشاير
حب كبير يزيد كل - ما طال وزاد بعادي

و شريكة عمري يا طير - بلغها عن شوق كثير
في عداب الفرقة نسيها - و بيوم قدومي هنيها
مع شموع الفرح اللي تقيد - في يوم المكتوب ينادي",مكتوبة كاملة,,,طرب ليبي,MohammedRasheed.jpg,غير معروف,لا بأس,https://on.soundcloud.com/AzsQs
526,يا ساحرة قلبي,محمد رشيد,"يا ساحرة قلبي - قلبي بسحر عيونك
يا سارقة نوم الهناء من عيني - نهون الحي ويحرم علية نهونك
ما يوم ننسى الود لو تنسيني
يا ساحرة
محال ننسى ايامي - ولا يوم ننسى في هواك كلامي
تحيرت في حبك وطال غرامي - وريت الهنى ومعاك شقيتينى
يا ساحرة قلبي بسحر عيونك
للقلب كنتي حبيبة - ريت الطرب كنتي حداي قريبة
نار المحبة في القلوب صعيبة - وبعد الفراق المر ضوقتيني
يا ساحرة قلبي بسحر عيونك
النار النار راهي فقلبي - ومن الشوق ما نقدر هواك نخبي
يا هاجرة بعدك القلب مهبي - وبعد الغرام بنار ليعتيني
يا سا حرة قلبي بسحر عيونك",مكتوبة كاملة,,,طرب ليبي,MohammedRasheed.jpg,غير معروف,لا يوجد,
527,يا قلبي ليه,محمد رشيد,"يا قلبي ليه - يا قلبي لواه
بتفكر فيه  - اللي ضرك هواه",الكلمات غير مكتملة,,,طرب ليبي,MohammedRasheed.jpg,غير معروف,جيد,https://on.soundcloud.com/qAW2c
528,يا ما ريت,محمد رشيد,"يا ما ريت بعيونك معاني - تحكي حب يسعدلي زماني
في قربك عرفته - طعم الحب لقلبي وصفته
يوم الورد لك بايدي قطفته - وكنت نخاف لو قلبك نساني
يا ما ريت فعيونك معاني 
سلمتك ورودي - وبان الحب يحكيلك عهودي
وهجريك ليش ما بيتي تعودي - ولا مرسول من يا لاك جاني
يا ما ريت بعيونك معاني
مش عارف غيابك - خايف بوك غيرلك صوابك
يريد المال ما يهمه عذابك - طول العهد يا ولفة زماني
يا ما ريت بعيونك معاني",مكتوبة كاملة,,,طرب ليبي,MohammedRasheed.jpg,غير معروف,لا يوجد,
529,يا ليل ساهر,محمد رشيد,,الكلمات غير موجودة,أحمد النويرى,كاظم نديم,طرب ليبي,MohammedRasheed.jpg,غير معروف,جيد,
530,يا شعبنا بشر شعوب العالم,محمد رشيد,,الكلمات غير موجودة,عمر المزوغي,,وطنيات,MohammedRasheed.jpg,غير معروف,جيد,https://on.soundcloud.com/Jf4eX
531,مرحب بشهر الصوم,محمد رشيد,,الكلمات غير موجودة,محمد الورفلي,محمد الدهماني,ابتهالات,MohammedRasheed.jpg,غير معروف,لا يوجد,
532,أنا ريت ورده لونها زهاني,محمد رشيد,,الكلمات غير موجودة,,,طرب ليبي,MohammedRasheed.jpg,غير معروف,جيد,https://on.soundcloud.com/D3dni
533,بان الصبح نواره زينه,محمد رشيد,,الكلمات غير موجودة,,,طرب ليبي,MohammedRasheed.jpg,غير معروف,لا بأس,https://on.soundcloud.com/whnVG
534,حبيب حبك في القلب,محمد رشيد,,الكلمات غير موجودة,,,طرب ليبي,MohammedRasheed.jpg,غير معروف,الصوت خافت,
535,حلو الحب حتى في عذابه,محمد رشيد,,الكلمات غير موجودة,,,طرب ليبي,MohammedRasheed.jpg,غير معروف,لا بأس,https://on.soundcloud.com/j9AEZ
536,خطبوك تم الفرح,محمد رشيد,,الكلمات غير موجودة,,محمد الدهماني,طرب ليبي,MohammedRasheed.jpg,غير معروف,جيد,https://on.soundcloud.com/qyWEq
537,رحل جارنا,محمد رشيد,,الكلمات غير موجودة,,,طرب ليبي,MohammedRasheed.jpg,غير معروف,جيد,https://on.soundcloud.com/tcMtn
538,رمضان كريم وفيه الباري يكرمنا,محمد رشيد,,الكلمات غير موجودة,,,طرب ليبي,MohammedRasheed.jpg,غير معروف,جيد,https://on.soundcloud.com/m7hnr
539,ريت بسمتك يا ورد,محمد رشيد,,الكلمات غير موجودة,,,طرب ليبي,MohammedRasheed.jpg,غير معروف,جيد,https://on.soundcloud.com/KeBNY
540,سهران الليالي,محمد رشيد,,الكلمات غير موجودة,,,طرب ليبي,MohammedRasheed.jpg,غير معروف,رديء,
541,صباح الخير على بلدي,محمد رشيد,,الكلمات غير موجودة,,,وطنيات,MohammedRasheed.jpg,غير معروف,جيد,https://on.soundcloud.com/Ka6X9
542,عقلي تاه,محمد رشيد,,الكلمات غير موجودة,,,طرب ليبي,MohammedRasheed.jpg,غير معروف,جيد,https://on.soundcloud.com/6gk7Y
543,فاح الربيع,محمد رشيد,,الكلمات غير موجودة,,محمد الكعبازي,طرب ليبي,MohammedRasheed.jpg,غير معروف,رديء,
544,ليبيا أغلى وطن,محمد رشيد,,الكلمات غير موجودة,,,وطنيات,MohammedRasheed.jpg,غير معروف,جيد,https://on.soundcloud.com/9t8uf
545,ليبيا وطني,محمد رشيد,,الكلمات غير موجودة,,,وطنيات,MohammedRasheed.jpg,غير معروف,لا بأس,https://on.soundcloud.com/zvULz
546,من كثر خوفي,محمد رشيد,,الكلمات غير موجودة,,,طرب ليبي,MohammedRasheed.jpg,غير معروف,جيد,https://on.soundcloud.com/yJ8J5
547,ننشد علي غواليا,محمد رشيد,,الكلمات غير موجودة,,,طرب ليبي,MohammedRasheed.jpg,غير معروف,رديء,
548,يا وردة البستان,محمد رشيد,,الكلمات غير موجودة,,,طرب ليبي,MohammedRasheed.jpg,غير معروف,جيد,https://on.soundcloud.com/7NMqa
549,يوم أبيض نور,محمد رشيد,,الكلمات غير موجودة,,,طرب ليبي,MohammedRasheed.jpg,غير معروف,جيد,https://on.soundcloud.com/uRKo7
550,ثورة جيش وشعب ,محمد صدقي,الثورة ثورة جيش وشعب - واليوم نحينا الشقى والتعب,مطلع الأغنية/رأس البيت فقط,أحمد النويرى,محمد صدقى,وطنيات,MohammedSedkee.jpg,غير معروف,جيد,https://on.soundcloud.com/Pi2sS
551,اليوم في الضحى,محمد صدقي,اليوم في الصبح ريت العزيز الغالي - للعصر ما با خاطري يصفالي,مطلع الأغنية/رأس البيت فقط,,,طرب ليبي,MohammedSedkee.jpg,غير معروف,جيد,https://on.soundcloud.com/Sqfoj
552,بديتي غلا ودي تدوم اقداره ,محمد صدقي,بديتي غلا ودي تدوم اقداره - زاهي ربيعه ما تصيف اخضاره,مطلع الأغنية/رأس البيت فقط,,,طرب ليبي,MohammedSedkee.jpg,غير معروف,جيد,https://on.soundcloud.com/cT3Tu
553,ذكرى حلوة,محمد صدقي,"ذكرى حلوة فكرت قلبي بحنانه - رجعتني فوق طريق شوك لزمانه
جيت معاها وفي العيون دمعة ندامة - جيت سامحني والغرام رجع ايامه",الكلمات غير مكتملة,,,طرب ليبي,MohammedSedkee.jpg,غير معروف,جيد,https://on.soundcloud.com/fh3BL
554,طول عمري مخلص ياغالي ,محمد صدقي,"طول عمري مخلص ياغالي - قلبي و روحي معاك
من غيرك ما عندي - والي في الدنيا يسواك
ارجع صافيني - ليش تجافيني وانا نهواك",الكلمات غير مكتملة,,,طرب ليبي,MohammedSedkee.jpg,غير معروف,رديء,https://on.soundcloud.com/p8XpR
555,ظلمتك معايا بعد حبيتيني ,محمد صدقي,ظلمتك معايا بعد حبيتيني - واجد تعدبتي خلاص انسيني,مطلع الأغنية/رأس البيت فقط,,,طرب ليبي,MohammedSedkee.jpg,غير معروف,جيد,https://on.soundcloud.com/B2bbb
556,عمرالغرام يهون,محمد صدقي,عمر الغرام يهون مابين يوم وليله - تنسى لى كان وتخون ياريت بيدى حيله,مطلع الأغنية/رأس البيت فقط,,,طرب ليبي,MohammedSedkee.jpg,غير معروف,جيد,https://on.soundcloud.com/vnWbk
557,في ذراعك اليمين ,محمد صدقي,في ذراعك اليمين - نقشت من اسمي حرفين,مطلع الأغنية/رأس البيت فقط,,,طرب ليبي,MohammedSedkee.jpg,غير معروف,غير كامل,https://on.soundcloud.com/VMs7m
558,قلبي نهيته ع الغلا دعانى ,محمد صدقي,قلبى نهيته ع الغلا دعانى - لاهو عشق ولاهو جفاى هنانى,مطلع الأغنية/رأس البيت فقط,,,طرب ليبي,MohammedSedkee.jpg,غير معروف,جيد,https://on.soundcloud.com/CZQhq
559,كيف نوصفك للناس وانت عالي,محمد صدقي,"كيف نوصفك للناس وانت عالي - فوق نجوم الليل الي شغلها حالي
ناسي عهدك - ناسي ورود الحب تشرح ودك
بسمة رقيقة نورت في خدك - على نورها كان الهواء يحلالي
غايب عني - خليت عندي شوق ما يرحمني
قلبي الي خنت خذيته مني - ظلمته وسهّرته معاك ليالي
كيف نوصفك للناس وانت عالي - فوق النجوم الي شغلها حالي",مكتوبة كاملة,,حسن عريبي,طرب ليبي,MohammedSedkee.jpg,غير معروف,رديء,https://on.soundcloud.com/eZP6a
560,لو فيك نوصل يا قمر يا عالي ,محمد صدقي,لو فيك نوصل يا قمر يا عالي - نجيبك هدية يوم عيد الغالي,مطلع الأغنية/رأس البيت فقط,,,طرب ليبي,MohammedSedkee.jpg,غير معروف,لا بأس,https://on.soundcloud.com/WzEXP
561,ليش تهجر حبى والماضى ,محمد صدقي,"ليش تهجر حبى والماضى - ياما عشت معاه
وهنيتك ونتى موش راضى - ع القلب ومشكاه
يازهوت عينى لمن يتخلينى
ناشاقى ونتى جافينى - وناسى عهدى معاك",وجب التأكد من اكتمال الكلمات,,,طرب ليبي,MohammedSedkee.jpg,غير معروف,جيد,https://on.soundcloud.com/H8ZvX
562,ما نعودلك لو القلب دوم اجدى,محمد صدقي,ما نعودلك لو القلب دوم اجدى - جفيت ليش راجعله زمانك عدى,مطلع الأغنية/رأس البيت فقط,فتحي العوج,سليمان بن زبلح,طرب ليبي,MohammedSedkee.jpg,غير معروف,لا بأس,https://on.soundcloud.com/WgVU4
563,مازال قلبي يريده,محمد صدقي,"مازال قلبي يريده - الغالي عزيز عليا
يفوتن سنين عديده - ولا نكرهه طاريا",مطلع الأغنية/رأس البيت فقط,,,طرب ليبي,MohammedSedkee.jpg,غير معروف,جيد,https://on.soundcloud.com/ge8uN
564,هانوا بعد كانوا على غوالى ,محمد صدقي,هانوا بعد كانوا على غوالى - والقلب حالف ما يريدش والى,مطلع الأغنية/رأس البيت فقط,,,طرب ليبي,MohammedSedkee.jpg,1962,جيد,https://on.soundcloud.com/tQNpR
565,هذه الارض هي العرض لنا ,محمد صدقي,"هذه الارض هي العرض لنا - قد سقينا تربها من دمنا
كيف نرضى ان نراها وطنا - لعدانا او سوانا ابدا",الكلمات غير مكتملة,,ابوفرج,طرب ليبي,MohammedSedkee.jpg,غير معروف,جيد,https://on.soundcloud.com/C67KX
566,هون غلاهم يازمان عليا,محمد صدقي,"هون غلاهم يازمان عليا - غلا جار ذيبلني إيعذب فيا
جار غلاهم - وعقلي نهيته قال ماننساهم - حتى إن جفو والا إشقيت وراهم
في حبهم راضي العذاب إبنيه 
والع بيهم - لاانسيتم لااسهيت يوم عليهم
إمرايف أو طول الليل نحلم بيهم - إرياف أو غلاء جارن اليوم عليا
غلاء حقاني - غلاء لاعني منه اليوم إنعاني
ياللي سبايب فرحتي واحزا ني - إنت إنسيتني والا نهوك عليا",مكتوبة كاملة,محمد مخلوف,,طرب ليبي,MohammedSedkee.jpg,1964,جيد,https://on.soundcloud.com/svqFA
567,يا بايعنى وانا شاريك ,محمد صدقي,يا بايعنى وانا شاريك - خلاص قلبى مافكر فيك,مطلع الأغنية/رأس البيت فقط,,,طرب ليبي,MohammedSedkee.jpg,غير معروف,جيد,https://on.soundcloud.com/rN7SZ
568,ياعين ديرى عزم,محمد صدقي,ياعين ديرى عزم فى فرقاهم - اولافك بعد كتب الله بخطاهم,مطلع الأغنية/رأس البيت فقط,,,طرب ليبي,MohammedSedkee.jpg,غير معروف,جيد,https://on.soundcloud.com/LsenN
569,يشهد نسيم الليل والنجم والصبحية ,محمد صدقي,يشهد نسيم الليل والنجم والصبحية - دمعي عليك يسيل يسيل يا غالية,مطلع الأغنية/رأس البيت فقط,,,طرب ليبي,MohammedSedkee.jpg,غير معروف,جيد,https://on.soundcloud.com/CM4r1
570,عقلى نوى لولاف,محمد صدقي,,الكلمات غير موجودة,رجب البكوش,صبري الشريف,طرب ليبي,MohammedSedkee.jpg,غير معروف,جيد,https://on.soundcloud.com/8RJdS
571,لا عيب درنا,محمد صدقي,,الكلمات غير موجودة,محمد مخلوف,محمد صدقي,طرب ليبي,MohammedSedkee.jpg,غير معروف,جيد,https://on.soundcloud.com/fWSCe
572,هلت ليالي العيد,محمد صدقي,,الكلمات غير موجودة,مسعود بشون,ابراهيم اشرف,طرب ليبي,MohammedSedkee.jpg,غير معروف,رديء,https://on.soundcloud.com/VAVSF
