Song Number,Song Name,Singer,Lyrics,Lyrics Status,Writer,Composer,Category,Image Name,Year,Recording Status,SoundCloud Link
1,هيروشيما,أحمد فكرون,"الحب كلمة للحبيب تنقال
فيه ناس ما يعرفوش مازال
تفكر و تصنع ف الدمار و النار
تقول ما شافوا عيون ااطفال
لا من هيروشيما تعلموها الحكمة
ولا من الحروب راف بيهم حال
لكن الخالق يقول مهما يطغى الانسان
رحلة و تنتهي بزوال",وجب التأكد من اكتمال الكلمات,,,بوب,AhmedFakroun.jpeg,غير معروف,جيد,https://on.soundcloud.com/fZ7aq
2,الشمس تجي و تعدي,أحمد فكرون,"الشمس تجي و تعدي - و الايام تفوت ما تهدي
وانا و انت زي الريح - ودك ما رافق ودي
مرة الهوى ياخدنا - للفرح معاه يسعدنا
و مره نتاخصم و احنا - عارفين الخصام يبعدنا
و الحيرة تلعب بينا - تعبانة خطاوينا
انا و انت مش عارفين - وين جينا وين ماشيين
لا فرحنا مع بعضنا -  و لا قدرنا على الحنين
و الحيرة تلعب بينا - تعبانة خطاوينا",مكتوبة كاملة,فرج المذبل,,بوب,AhmedFakroun.jpeg,غير معروف,جيد,https://on.soundcloud.com/vwGnk
3,الصحراء,أحمد فكرون,"الصحراء فيها عاشق و حبيب و ترحال
الصحراء فيها بعاد وخطاوي و رمال
دقات الطبول تنادي من بعيد
ودروب الوصول تخاطر من جديد
مناظر تردت لصمت الجبال
ومركب الشمس في نهج الخيال
يا سمراء تبان من تحت اللثام
يا كنوز و جوارح و النظرة كلام
محلاها الغناوي اصوات و ابتسام",مكتوبة كاملة,,,بوب,AhmedFakroun.jpeg,غير معروف,جيد,https://on.soundcloud.com/yhgzo
4,القلب عاشق,أحمد فكرون,"القلب عاشق وارتمي في جورك
نقطة عشق ذابت فوسع بحورك
ارحم دموعي العشق شوقه قاسي
والنور يطفي وقت يغمر نورك
تنادي عليا نسمعك ونجيب وتقسي
على روحي الدموع تسيب فرج
عذاب الضيق وأنت رحيب همس الأمل
فالقلب جابد شورك العشق
واعر وأنت بيه عليم وراضي
عذاب الروح فيك تهيم طالب ألرحمه
وفاصلاة دمعاتي ترسم طريقي
نين يوم نزورك والقلب عاشق شالني
وراني نغلب ضعف نفسي بنور إيماني
وتبدي طريقي فالطريق طريقك
ونزرع حياتي في سهول زهورك .",مكتوبة كاملة,نبيل الجهمي,,بوب,AhmedFakroun.jpeg,غير معروف,جيد,https://on.soundcloud.com/4v5Db
5,هارب من الليالي,أحمد فكرون,"اه يا هارب في الليالي - من الليالي في الضباب
حزن قلبك في قلبك - من عذابك في العذاب",الكلمات غير مكتملة,,,بوب,AhmedFakroun.jpeg,غير معروف,جيد,https://on.soundcloud.com/mbD8x
6,اوعدني ,أحمد فكرون,اوعدني وما تسبنيش,مطلع الأغنية/رأس البيت فقط,رجب شرشر,,بوب,AhmedFakroun.jpeg,غير معروف,جيد,https://on.soundcloud.com/99CxU
7,سوف الجين,أحمد فكرون,"تعال خبر ياسوف الجين - ع القديمين - عرب كانت تعرفها وين
تعال خبر واحكي بالحق - على ريته قبل وزال
اليوم خالي مافيك رشق - طرى لك ماطاري لتلاك
الناس اللي بيهم شارق - اللي كانوا عزوه للمال
تقاصوا عنك خشوا رق - سرابه ع العالي هيال (الرق : اي المنطقة الصحراوية)
ان ما جوني لازم نلحق - بزادي وزوادي وجمال
ونقطع غيم يبان ازرق - بلا تظنين - بزادي ورجالي وعوين
تعال خبر ماريت عرب - ولا ريت نجوع كثيرات
ولا ريت عساكر تلعب - لهن سنزق فيه علامات (سنزق: سنجق أو راية بالتركي)
يفزن كان البوق ضرب - لجيه فيسع ملزومات
جنود يكيدن من يحسب - عددهن سربه بالميات
وحاكم يصلب كان غضب - أمير على ست آلايات (آلايات: ألوية)
يونس وين يجي راكب ... ينوض منه مقبوضات
يتم عليهن يصلب - نداوى بادي في حوزات (نداوى: نوع من الصقور - حوزات: أسراب من الحبارى)
نهار اللي يداري ع السب - تحجي دون الحوماوات
ضرب جا طايح يشقلب - وتم ينين - تعرم بين العراكين
تعال خبر ياسوف الجين - تعال خبر ياسوف الجين
تعال خبر ماريت قديم - ولا ريت نواجع حكام
ولا ريتش مال جراثيم - شون ياسر كادن لزدام  (جراثيم لا تعني المعنى السائد حاليًا بل تعني كثيرة)
ولا ريتش خيل ملاضيم - أدب ناس ملايا بالنام
يفرن لا صار التنغيم - منين طق الميصور وزام (المبصور: الطبل)
يجن غير تقول براريم - منين ثوب البيضا يدغام
منين فيهن صار التعريم - وطاح الزين - فني من هذين وهذين",مكتوبة كاملة,بن رويلة المعداني,,بوب,AhmedFakroun.jpeg,غير معروف,جيد,https://on.soundcloud.com/HqXxv
8,حلوة الصورة لك يا انسان ,أحمد فكرون,"حلوة الصورة لك يا انسان - اللون اسمر والجبين عرقان
ترسم خطوطك فوق صدر الأرض – وتفرح بعدما عيدان خضر تبان
وتغني بهنا للحب مواويل – ترد السنابل عالغناء وتميل
وتمسح عرق جهدك بكل حنان
وحلوة الصورة لك يا إنسان
اللون أسمر والجبين عرقان",وجب التأكد من اكتمال الكلمات,,,بوب,AhmedFakroun.jpeg,غير معروف,جيد,https://on.soundcloud.com/oJmzn
9,عمر المختار - يا مختار,أحمد فكرون,"رافع الجبهة وفي الجبهة الزمان في أيدك كتاب الله
وفي الأخرى الوطن عنوان لا مجد طامع فيه لا ثروة
لا سلطان وطامع في نعيم الله وفي الجنة مكان أمان
يا مختار يا سيدي عمر يا شيخ يا إنسان في التاريخ
ناقش بالدماء اسمك وبالا يمان لقيت وجه الله
شهيد الحب والأوطان يا مختار يا سيدي عمر
يا شيخ يا إنسان في الوجدان",وجب التأكد من اكتمال الكلمات,نبيل الجهمي ,,بوب,AhmedFakroun.jpeg,غير معروف,جيد,https://on.soundcloud.com/eN26f
10,سلف مردود,أحمد فكرون,"سلف مردود سلف كيف الصاغ المنقود سلف مردود
سلف فيه اقصاد ومقصود سلف جاني من غنايين
سلف لاقيته دون الرود عرب بالشينه مغنومين
فلان فلان النود النود عرموم حساد عنيدين
لهم من ميلود لميلود عرب يا ناري منقرضين
مغير جواجي تحت جرود أجعنهم فحمة كوم عوين
أجعن باب غناهم مسدود أجعنهم قدام الحيين
قليليين الزرع وهبود كما اللي حرك لغم المين
وم الساعة تك البارود كبايا ردوا مكسورين
كما طايح عظمه مقنود تدقديق قران موزين
جفل حاشيهن يوم ورود كما اللي عند الموالين
ورد بالنقضه يوم عمود أربع مايدور الصفارين
شهر في اللي قبل الميلود علي بو فلاقه مسكين
نطق لا ناشد لا منشود بحث بحثة تيس لسكين
اللي فيه الجزار يقود خصوصاً لي كان قرين
مغير رقادة ريح وهود المسلم لا طق الستين يتوب
وكان بخيل يجود وهو وين اشرف ع السبعين قدع
رد مع الجهل ردود لنوار الشيب تسودين تقول
يغري في كرمود ويركب في اشنابه تدهين
ويطلاهن نغج وبارود ومحرمته فيها هذين
دبش واتي ديما مجبود ثلاث مكاحل ومراتين
ومرود عاج ومرود عود يغوص في كل كوازين
يجي قايد ويجي مقيود وينشد ع الهجاله وين
اللي متبع واللي جلمود لبكره مسع دار خزين
كمل عمره تسويف كنود يصبي بين الصفاقين
وزايد ع الصف بعلود يقول لبو دور عراجين جضاري
جالن ع المقصود خذا مني ها الجرانين عطاء الله
بغير حسود غبا يقعد قرنين سنين وهو مرفود
كما منهل جا تحت غرود ",مكتوبة كاملة,حسن الفاخري ,,بوب,AhmedFakroun.jpeg,غير معروف,جيد,https://on.soundcloud.com/JTeUv
11,شوارع المدينة,أحمد فكرون,"شوارع المدينة - وجوه آه وجوه
وجوه بالفرحة تنعم وفيها وجوه حزينة

في ناس ضحكتها حلوة وعرقها ع الجبين
يرسم ف الجبهة نشوة تمسح تعب السنين
ويغني الحب غنوة مكتوبة للحنين
بحروفها ألوانها زينة - شوارع المدينة

في ناس باين أساها من غير قسوة دموع
والحزن اللي ملاها ضاقت بيه الضلوع
هبت حركة هواها ضوّت لهب الشموع
عن حبه وأنينه - شوارع المدينة

والحيطان الكثيرة مزروعة ع الدروب
لا هد شوق هواها لا الحيرة والهروب
مرسومة فوق عيونها كلمات حب وقلوب
تشهد عنا وعلينا- شوارع المدينة

شوارع المداين شوارع المدينة - وجوه آه وجوه
وجوه بالفرحة تنعم وفيها وجوه حزينة",مكتوبة كاملة,نبيل الجهمي,,بوب,AhmedFakroun.jpeg,غير معروف,جيد,https://on.soundcloud.com/PDvu5
12,طاحن نجوم الليل ,أحمد فكرون,طاحن نجوم الليل وانت وينك قردك مرض ولا خداتك عين,مطلع الأغنية/رأس البيت فقط,,,بوب,AhmedFakroun.jpeg,غير معروف,جيد,https://on.soundcloud.com/4tC1h
13,عالبحر مرة شفتك,أحمد فكرون,"ع البحر مرة شفتك وتاه مني الكلام
قلت لنفسي وين شفتك ولقيتك في الأحلام
وأستنيت يما وأستنيت ع البحر أو رأجيت
أنا وخيالي وصورتك أنا وحنيني وسيرتك
وأنتي ما جيتي ثاني وأنا ما لقيت نسياني
وقلت ياليام حقيقة كنتي وألا أحلام
ع البحر مره شفتك",وجب التأكد من اكتمال الكلمات,أحمد فكرون ,,بوب,AhmedFakroun.jpeg,غير معروف,جيد,https://on.soundcloud.com/qcMmK
14,جامع الفناء,أحمد فكرون,عجوز بقيثارة يروي في اشعاره - نغمة اوتاره الام و احزان,مطلع الأغنية/رأس البيت فقط,,,بوب,AhmedFakroun.jpeg,غير معروف,جيد,https://on.soundcloud.com/Hz7it
15,عيونك,أحمد فكرون,"عيونك عيونك
عيونك نظرة حزينة
تحكي عالحب و انينه",الكلمات غير مكتملة,,,بوب,AhmedFakroun.jpeg,غير معروف,جيد,https://on.soundcloud.com/2FKfy
16,عوام,أحمد فكرون,"فالليلة والبدر يطل ويانوار ويقول سلام
وينثر عشقك ورد وفل ويرسل
حبك فالانسام وفي شعرك ليلا سبال
وفي فيومك كلمات غرام وفي عيونك
بحرين عسل نا قلبي في عشقك
عوام عوام والبحر نادالي
عوام ونتي في بالي
عوام دورت عليكي عوام قالو نلاقيكي
عوام في البحر العالي عوام بحور كاهاث
عوام بحورك بالطول لا نبغا مرسي ولأشط
وراضي باللي الناس تقول وطالب يغلبني
فالشوق غرامي ولما القلب ينول غرامك
نعبر بيه الليل ونرضي بعيونك مرسول عوام
بحورك عشقات وعالي موجك فوق لفوق
وراضي يا خذني تيار ونغرق وقت الموج يروق
وتعلا بيا الريح نريح لا طالب لا مركب لا طوق
مرادي في بحورك عوام وعقاب عمري راضي بالشوق ",مكتوبة كاملة,نبيل الجهمي,,بوب,AhmedFakroun.jpeg,غير معروف,جيد,https://on.soundcloud.com/6ky9q
17,ترحال,أحمد فكرون,"في الترحال في الترحال
رحلة حرف في الكلمة
سفر للشوق بالنسمة
بلهفة الناي للموال
في الترحال في الترحال",الكلمات غير مكتملة,,,بوب,AhmedFakroun.jpeg,غير معروف,جيد,https://on.soundcloud.com/eAsw2
18,عيون سالمة,أحمد فكرون,"في الليل - في نجوى الغريب وشوقه
في الحزن - في رعود الشتى وبروقه
تخطر عليا سالمه - ونشتاق صمت عيونها

في الحب - ف أنفاسه - ف نبض عروقه
في الياس - وأوصال الأمل محروقة
تصعب عليا سالمه - وتصعب دموع عيونها

عيون سالمه تذكار - على جبين غيمة عاشقه
عيون سالمه أشعار - ف خيال ليلة بارقة
عيون سالمه أسرار - ف أحضان نجمه مفارقه
عيون سالمه أقدار - ف احزان مركب غارقة

عيون سالمة تذكار - فكره وشمعه ساهرة محتاره
عيون سالمة أشعار - واحلام نخله شامخه جباره
عيون سالمة أسرار - وشباك معبد شاحبات أنواره
عيون سالمه أقدار - وعنقود موجه عاتية مغياره

سحر الوجود ومصدره ومصيره - عيون سالمه تحكيه
وبعد الفضا وحيرته وتحييره - عيون سالمه تخفيه
وحلم النسيم وصحوته وتكديره - عيون سالمه تواريه
وجلال البحر ورهبته وهديره - عيون سالمه تجاريه

في عيون سالمه يبني العز اسوار - عليها أبراج محصنه وعنيده
في عيون سالمه يرسم الظل أشجار - وتطلع سنابل واعدة وجديدة
في عيون سالمه تهاجر طيور وانهار - وتقصد شطوط ملونه وبعيده

يمتد المكان ويستوي - وعيون سالمه أبعاد
زيعلا الزمان وينحني - وعيون سالمه ميعاد
وينوّر الوعد ويرتوي - وعيون سالمه ميلاد
ويبدا الحب وينتهي - وحب سالمه يزداد",مكتوبة كاملة,الصيد الرقيعي,,بوب,AhmedFakroun.jpeg,غير معروف,جيد,https://on.soundcloud.com/j6pZV
19,نسيان,أحمد فكرون,"فين ضاع الحنان و الحب اللي كان
نقولك يا حبيبي تقولي كان زمان
فين فرحة عيونك وين كنت نلاقيك 
فين حيرة ظنونك وين نغيب عليك
ونشوف في عيونك نظرات النسيان

من غير ما انت تقول حسيت بالنهاية
عني بالك مشغول و فكرك مش معايا
وين تقابلني تبقى مشغول عني
ونشوف في عيونك نظرات النسيان",مكتوبة كاملة,,,بوب,AhmedFakroun.jpeg,غير معروف,جيد,https://on.soundcloud.com/cx2kz
20,سندباد,أحمد فكرون,"قلبي سندباد متغرب في عيونك
كنز الحلم بلاد متغطي بجفونك
خوذ يني يا بهجت عيني
دفيني يا شمس سنيني
قبل يأخذنا الميعاد من صغري
رحال في حضن المواني
خطواتي مزال أتدور عن زماني
وأشوفك يا صوت غنايا مرسومه
فالحلم حكايا من حكاوي شهرزاد
لك قلبي مشتاق يابحر الأغاني

ولمركب متزود بفراحي وحزاني
ونشوفك في ظل الشمعة طيف
إيجي ويغيب في دمعه واللهفة تحت الرماد .
",مكتوبة كاملة,فرج المذبل ,,بوب,AhmedFakroun.jpeg,غير معروف,جيد,https://on.soundcloud.com/zLk1p
21,قلبي مجنونك يا ليلى,أحمد فكرون,"قلبي مجنونك يا ليلي ايغني للكون مواويله
في بحر عيونك يا ليلي مركب عمري تاه دليله
ونا ونتي حكاية يا ليلي من حكاوي ألف ليله
أه يا ليلي أه يا ليلي
لفيت المداين يا ما نحلم بيك
يا طيف النور قلبي المجداف والعوامة بيه
عدية السبع بحور لا ما ألقيتك
لا ما أنسيتك ولاعنك تشغلني حيله
أه يا ليلي أه يا ليلي
عدية يا ما صحاري وجبال وديان وسهول
تعبني وأتعب مشواري في دروب الحب المجهول
ومهما يكون قلبي المجنون ما أيغني ألغيرك يا ليلي
ومهما يكون قلبي المجنون ولا يغزل شعر مراسيله
أه يا ليلي أه يا ليلي .",مكتوبة كاملة,فرج المذبل ,,بوب,AhmedFakroun.jpeg,غير معروف,جيد,https://on.soundcloud.com/samqB
22,لا يا حب,أحمد فكرون,لا يا حب لا تسهر عيوني - لي كون و لا تخيب ظنوني,مطلع الأغنية/رأس البيت فقط,,,بوب,AhmedFakroun.jpeg,غير معروف,جيد,https://on.soundcloud.com/Qm8p9
23,عيون سماح ,أحمد فكرون,"مرايف عليك البال - يم عيون سماح
و الصبر طال وطال - و الجرح صار جراح
لاتنشدي و نسال - و القلب ابدمعه باح
سبحان كيف النسو - ما قدر عليه سلاح
 
مرايف عليك الليل - و راسك علي خدي
و يدك بلا ما نقول - ما انقول تطلب دفايدي
 البدر كي قنديل - ونسمة هواه اتهدي
و صوتك همسفي الحب - في نبرته نرتاح
سبحان كيف النسو - ما قدر عليه سلاح

مرايف عليك العقل - مرايف على عيونك
لون الورد جدد - شوق لسحرلونك
يشهد عليا الله - ابقو الهوى نصونك
عد ىالعمر آهات - و م العمر ياما راح
سبحان كيف النسو - ما قدر عليه سلاح

مرايف عليك العقل - وفكره ملك فكرك
ولما الورد ف الريف - ينشر شذا عطرك
يزهى العقل لحظات - ويرجعه ذكرك
ليام كانالحب ب- سمة أمل و افراح
سبحان كيف النسو - ما قدر عليه سلاح",مكتوبة كاملة,نبيل الجهمي,,بوب,AhmedFakroun.jpeg,غير معروف,جيد,https://on.soundcloud.com/Bffff
24,مش كفاية,أحمد فكرون,"موش كفاية  - موش كفاية - موش كفاية - موش كفاية
موش كفاية أني بحبك - موش كفاية - موش كفاية
حبك أرحب من حناني - و من حنان الكون معايا
موش كفاية - موش كفاية
أنتي حبك معنى تاني - غير المحنة و المحبة - و الأماني
موش كفاية - موش كفاية - موش كفاية - موش كفاية
موش كفاية - أني بحبك - موش كفاية

يمكن عبير - يمكن أمل - يمكن تهاني
موش كفاية - موش كفاية - موش كفاية - موش كفاية
موش كفاية - أني بحبك

حبي أكبر من عواطفي - من طموحي و من كياني
حبي أكبر من هوايا - من حنان الكون معايا -

و لو كبر البحر قلبي - و نسماته حنان اتهب
و لو سحر الزهر دربي - و بسماته أمان و حب
كان هواك صادف هوايا - يمكن اتكون البداية
موش كفاية - موش كفاية - موش كفاية - موش كفاية",مكتوبة كاملة,صالح عباس,,بوب,AhmedFakroun.jpeg,غير معروف,جيد,https://on.soundcloud.com/VdfpH
25,فلسطين الحبيبة,أحمد فكرون,"يا طفل عايش في خيام الهم
شايل عذابك في عيون الم
بوك في جهاده وعاش ديما يقول
حفنة تراب في الوطن تسوأ دم
فلسطين ألحبيبه جرحه كان مزال
فلسطين ألحبيبه جرحه كان مزال
مصيرها بصمودك يوم يوم يلتم
يا طفل عايش في خيام الهم
وشايل عذابك في عيون الم
فلسطين ألحبيبه جرحه كان مازال
مصيره بصمودك يو يو يلتم .",مكتوبة كاملة,,,بوب,AhmedFakroun.jpeg,غير معروف,جيد,https://on.soundcloud.com/wov7b
26,النورس,أحمد فكرون,"يا نورس يا حالم ع شط البحر
أحلامنا و أيامنا نادت - شوق و رحلة و سفر

أنا و الشاطي الوحيد - نبضاتي شراع
ايرف جناحي - خلف المدى
تعلا بيك الريح - من علو الغريق
ع جناحك تمد الشمس - و تنسج خيوط ألأمس
ع رحلة بدت بالصدفة - و غناوي طفاها الهمس

حسيت بالآمان - جنبك يا غريب
غرّبني المكان - يا حضني الحبيب
يرحل فيك القمر - و يغرب فيك السهر
على أمل من تاني - نحلم بالسفر
يعلا بيك الريح - من علو الغريق
على اجناحك اتمد الشمس - و تنسج خيوط الأمس
لرحلة بدت بالصدفة - غناوي طفاها الهمس",مكتوبة كاملة,أحمد فكرون ,,بوب,AhmedFakroun.jpeg,غير معروف,جيد,https://on.soundcloud.com/vehbZ
27,يابلادي حبك موالي,أحمد فكرون,"يابلادي حبك موالي - عليك والله مايغلى غالي
يابلادي ياحلوة - يانسمة حنان وغنوة
انا العاشق وانتي النجوى - اللي تملا فكري وخيالي
في عيونك انتي - شفت بوي وامي وحبيتي
طفلي بكرة وضحكة بنتي - وتراب جدودي الغوالي",مكتوبة كاملة,فرج المذبل,,بوب,AhmedFakroun.jpeg,غير معروف,جيد,https://on.soundcloud.com/DLm9T
28,يمه (يا أماه),أحمد فكرون,"يمه يمه يمه يمه يمه يمه
لبتنا القديم حنيت للحنان
وين هم لصحاب وين هم الجيران
يخدوني معاهم للود و الأمان",وجب التأكد من اكتمال الكلمات,فرج المذبل,,بوب,AhmedFakroun.jpeg,غير معروف,جيد,https://on.soundcloud.com/CPiWY
29,شباكك ساهر مفتوح,أحمد فكرون,,الكلمات غير موجودة,صالح عباس,,بوب,AhmedFakroun.jpeg,غير معروف,جيد,https://on.soundcloud.com/stuwu
30,يا حساد قاهركم هنانا,أحمد فكرون,,الكلمات غير موجودة,فرج الطيرة,,بوب,AhmedFakroun.jpeg,غير معروف,جيد,https://on.soundcloud.com/T2PJK
31,ربيع سنين,أحمد فكرون,,الكلمات غير موجودة,فرج المذبل,,بوب,AhmedFakroun.jpeg,غير معروف,جيد,https://on.soundcloud.com/vSpwY
32,اه يا اسكندرية,أحمد فكرون,,الكلمات غير موجودة,,,بوب,AhmedFakroun.jpeg,غير معروف,جيد,https://on.soundcloud.com/EH8DE
33,انتظار,أحمد فكرون,,الكلمات غير موجودة,,,بوب,AhmedFakroun.jpeg,غير معروف,جيد,https://on.soundcloud.com/p1mJ5
34,بعد الفراق,أحمد فكرون,,الكلمات غير موجودة,,,بوب,AhmedFakroun.jpeg,غير معروف,جيد,https://on.soundcloud.com/HYuEd
35,تمر أيام و تمر سنين,أحمد فكرون,,الكلمات غير موجودة,,,بوب,AhmedFakroun.jpeg,غير معروف,جيد,https://on.soundcloud.com/LmWzj
36,صياد و رامي شبكتي,أحمد فكرون,,الكلمات غير موجودة,,,بوب,AhmedFakroun.jpeg,غير معروف,جيد,https://on.soundcloud.com/9i1i8
37,عابر يا زمان,أحمد فكرون,,الكلمات غير موجودة,,,بوب,AhmedFakroun.jpeg,غير معروف,جيد,https://on.soundcloud.com/7w9fZ
38,عالم ثاني,أحمد فكرون,,الكلمات غير موجودة,,,بوب,AhmedFakroun.jpeg,غير معروف,جيد,https://on.soundcloud.com/z7rZp
39,على حنيني,أحمد فكرون,,الكلمات غير موجودة,,,بوب,AhmedFakroun.jpeg,غير معروف,جيد,https://on.soundcloud.com/hhBZ2
40,عيون الحور,أحمد فكرون,,الكلمات غير موجودة,,,بوب,AhmedFakroun.jpeg,غير معروف,جيد,https://on.soundcloud.com/MCq8u
41,في المدن الكبيرة,أحمد فكرون,,الكلمات غير موجودة,,,بوب,AhmedFakroun.jpeg,غير معروف,جيد,https://on.soundcloud.com/Sdhyq
42,قلتي النوم هرب من عيني,أحمد فكرون,,الكلمات غير موجودة,,,بوب,AhmedFakroun.jpeg,غير معروف,جيد,https://on.soundcloud.com/zrxT3
