Song Number,Song Name,Singer,Lyrics,Lyrics Status,Writer,Composer,Category,Image Name,Year,Recording Status,SoundCloud Link
229,يا عين عديهن ايام غلانا,سيد بومدين (شادي الجبل),"ياعين عديهن ايام غلانا - ذكرى مضت من حبنا وزهانا
 
 ماتجبديش الماضي - طرواه ياعيني يرق غراضي
 اياماً وكان الدهر عنه راضي - ماعمر قصر غالياً في رضانا
 اليوم يالعين مناك ماهو فاضي - غني بغيرنا بالك ترك مدعانا
 
 ماتجبديش ايامه - عيشي على ذكرى اسنين غرامه
 يا عين طاري غالياً واوهامه - اخطوره علي غفلات قل هنانا
 بعد ماصعب ريدك لذيذ كلامه - عديه ماضي زال فات زمانه
 
 ماتجبديش سريبه - ماضي غلانا خير ماتدويبه
 لوكان ياعيني ابكاك يجيبه - نقول اذرفي بالك يعود منانا
 لكن بعد ريدك القيه نصيبه - انسيه من بالك اكفا نسيانا",مكتوبة كاملة,سيد بومدين (شادي الجبل),,شعبي,ShadeeAljabal.jpg,غير معروف,جيد,https://on.soundcloud.com/ZGBHf
230,يا عيني توبي ع البكي,سيد بومدين (شادي الجبل),ياعيني توبي ع البكي - ونسى مدعاه اللي جفى,مطلع الأغنية/رأس البيت فقط,سيد بومدين (شادي الجبل),,شعبي,ShadeeAljabal.jpg,غير معروف,جيد,https://on.soundcloud.com/5vRCm
231,يا ليل نا طولك شقاني و منك نعاني,سيد بومدين (شادي الجبل),ياليل نا طولك شقاني و منك نعاني - سهران و النوم هاجرني جفاني,مطلع الأغنية/رأس البيت فقط,سيد بومدين (شادي الجبل),,شعبي,ShadeeAljabal.jpg,غير معروف,جيد,https://on.soundcloud.com/hFC99
232,يا مشكاي يا مسهر عيوني,سيد بومدين (شادي الجبل),يامشكاي يا مسهر عيوني - هجرك طال خيبلي ظنوني,الكلمات غير موجودة,سيد بومدين (شادي الجبل),,شعبي,ShadeeAljabal.jpg,غير معروف,جيد,https://on.soundcloud.com/9Xb6f
233,يز العين من قولت غراضي,سيد بومدين (شادي الجبل),"يز العين من قولت غراضي - وما التخميم في جرت الماضي
 من قوات حبيبي - وللتخميم عيني ما طيبي
 في سباه جريك راه عيبي - إنتي تبيه وهو موش راضي
 
 من قولت فلاته - وهو دوم موجابد غلانه
 احنا ننسوه من يوما نسانا - نشقوا بزول للغيات فاضي
 
 من قوات الغالي - تركه خير من حبه اولالي
 عن مدعاه عيني ماتسالي - خير انسيه بريلي امراضي",وجب التأكد من اكتمال الكلمات,سيد بومدين (شادي الجبل),,شعبي,ShadeeAljabal.jpg,غير معروف,جيد,https://on.soundcloud.com/ruWqY
234,يعشم فيك قلبي اللي جفيته,سيد بومدين (شادي الجبل),يعشم فيك قلبي اللي جفيته - هنت الحب من بالك نسيته / وعهد الحب من بعدك سليته,مطلع الأغنية/رأس البيت فقط,سيد بومدين (شادي الجبل),,شعبي,ShadeeAljabal.jpg,غير معروف,جيد,https://on.soundcloud.com/81fKV
235,يمنجي نجيه,سيد بومدين (شادي الجبل),يمنجي نجيه يسلملي نور العين - ريدي روح دليلي - مشكاي حدود الزين,مطلع الأغنية/رأس البيت فقط,سيد بومدين (شادي الجبل),سيد بومدين - شادي الجبل,شعبي,ShadeeAljabal.jpg,غير معروف,جيد,https://on.soundcloud.com/h8NNS
236,انا اللي غرسته حاضيها,سيد بومدين (شادي الجبل),,الكلمات غير موجودة,سيد بومدين (شادي الجبل),,شعبي,ShadeeAljabal.jpg,غير معروف,جيد,https://on.soundcloud.com/fcSAL
237,جلسة - مع علي الشعالية وعائشة بنت بشير,سيد بومدين (شادي الجبل),,الكلمات غير موجودة,سيد بومدين (شادي الجبل),,شعبي,ShadeeAljabal.jpg,غير معروف,رديء,
238,جلسة - مع علي ويكا الجهاني,سيد بومدين (شادي الجبل),,الكلمات غير موجودة,سيد بومدين (شادي الجبل),,شعبي,ShadeeAljabal.jpg,غير معروف,جيد,https://on.soundcloud.com/eisYL
239,زمانه عدى ما ننساه,سيد بومدين (شادي الجبل),,الكلمات غير موجودة,سيد بومدين (شادي الجبل),,شعبي,ShadeeAljabal.jpg,غير معروف,جيد,https://on.soundcloud.com/CeutM
240,طولتي الغيبة,سيد بومدين (شادي الجبل),,الكلمات غير موجودة,سيد بومدين (شادي الجبل),,شعبي,ShadeeAljabal.jpg,غير معروف,جيد,https://on.soundcloud.com/LxpYY
241,ع الغيات توبن يا انظار,سيد بومدين (شادي الجبل),,الكلمات غير موجودة,سيد بومدين (شادي الجبل),,شعبي,ShadeeAljabal.jpg,غير معروف,لا بأس,https://on.soundcloud.com/rHCEw
242,قلبي كويته بنار,سيد بومدين (شادي الجبل),,الكلمات غير موجودة,سيد بومدين (شادي الجبل),,شعبي,ShadeeAljabal.jpg,غير معروف,جيد,https://on.soundcloud.com/cdmGP
243,لي عين غرضها كابر,سيد بومدين (شادي الجبل),,الكلمات غير موجودة,سيد بومدين (شادي الجبل),,شعبي,ShadeeAljabal.jpg,غير معروف,جيد,https://on.soundcloud.com/Whcy9
244,نا داي ماهو متواري,سيد بومدين (شادي الجبل),,الكلمات غير موجودة,سيد بومدين (شادي الجبل),,شعبي,ShadeeAljabal.jpg,غير معروف,جيد,https://on.soundcloud.com/5qzFC
245,وان التسقيدة,سيد بومدين (شادي الجبل),,الكلمات غير موجودة,سيد بومدين (شادي الجبل),,شعبي,ShadeeAljabal.jpg,غير معروف,لا يوجد,
246,يا لواي الشال,سيد بومدين (شادي الجبل),,الكلمات غير موجودة,سيد بومدين (شادي الجبل),,شعبي,ShadeeAljabal.jpg,غير معروف,جيد,https://on.soundcloud.com/hSXW4
247,يا مسهر عيوني,سيد بومدين (شادي الجبل),,الكلمات غير موجودة,سيد بومدين (شادي الجبل),,شعبي,ShadeeAljabal.jpg,غير معروف,جيد,https://on.soundcloud.com/6EqAW
248,يانا لي هاين علي مشكايا,سيد بومدين (شادي الجبل),,الكلمات غير موجودة,سيد بومدين (شادي الجبل),,شعبي,ShadeeAljabal.jpg,غير معروف,جيد,https://on.soundcloud.com/XWE7k
249,يللي غالي نريد نرسلك ياروح,سيد بومدين (شادي الجبل),,الكلمات غير موجودة,سيد بومدين (شادي الجبل),,شعبي,ShadeeAljabal.jpg,غير معروف,جيد,https://on.soundcloud.com/MnQUJ
250,مرحب ياجدال قرونه,علي ويكا الجهاني,"ابيات مجرودة
مرحب ياجدال قرونه - يالبسط ضاوى جبنونه
يابو خد ضوايا زونه - كان معاى تخش الجونه
نحكيلك ع الهول ولونه - هلى من روما لامونا
كنسة فرعية كنسونا - جابونا من غير اعداد",الكلمات غير مكتملة,,,شعبي,AliWika.jpg,غير معروف,لا بأس,https://on.soundcloud.com/VcH4f
251,ضيم بوحلق نقض عليا امراضى,علي ويكا الجهاني,"اغنية
ضيم بوحلق نقض عليا أمراضي - وخطر عليا ما مضى من الماضي
يا منونه - حنى على كبدي لى مسحونه - فى مامضى كنتي نعم مرهونه
واليوم فاضيه وانا مثيلك فاضي

ياريت مالاقيته - وياريتني بالعين ماحقيته
نظيف المجالى قبل قلت نمسيته
وين ماخطر رقن معاه غراضي

برول
ياريدى كنك جفال - عليك امان الله تعال
كنك جافينا - لاتنشد لاتسال علينا
ضاع وراك العقل احيينا - من غيرك ماجا ع البال

كنك ماتجيش - لاتنشد لاتسال عليش
فى حبك عقلى درويش - مريض زايد بيه الحال",مكتوبة كاملة,,,شعبي,AliWika.jpg,غير معروف,لا بأس,https://on.soundcloud.com/PVQ4P
252,النقار يطرد فى طويل عقاصه,علي ويكا الجهاني,النقار يطرد فى طويل عقاصه - شور الغلا لاجربه لاقاسه,مطلع الأغنية/رأس البيت فقط,,,شعبي,AliWika.jpg,غير معروف,لا بأس,https://on.soundcloud.com/5j1TJ
253,انت دواء للعين وانت داها,علي ويكا الجهاني,انت دواء للعين وانت داها - وانت سبايب همها وبكاها,مطلع الأغنية/رأس البيت فقط,,,شعبي,AliWika.jpg,غير معروف,لا يوجد,
254,بعته جناني و نخيلي,علي ويكا الجهاني,بعته جناني و نخيلي - غير يا بنية طيعيلي,مطلع الأغنية/رأس البيت فقط,,,شعبي,AliWika.jpg,غير معروف,لا بأس,https://on.soundcloud.com/9UuE4
255,بلا ولفتى مابه النوم يجيني,علي ويكا الجهاني,بلا ولفتى مابه النوم يجيني - ويليها - الخاطر اداعالك وتالى وله,مطلع الأغنية/رأس البيت فقط,,,شعبي,AliWika.jpg,1972,رديء,
256,جاء صدافكن مرهون يامطراكن,علي ويكا الجهاني,جاء صدافكن مرهون يامطراكن - نقض جرحكن محال يبرا داكن,مطلع الأغنية/رأس البيت فقط,,,شعبي,AliWika.jpg,1978,لا بأس,https://on.soundcloud.com/ibXTa
257,جنى السوايا من الحبيب الدانى,علي ويكا الجهاني,جنى السوايا من الحبيب الدانى - نوم الهنى لانعرفه لاجانى,مطلع الأغنية/رأس البيت فقط,شاعر قديم يهودى,,شعبي,AliWika.jpg,1970,لا بأس,https://on.soundcloud.com/Zm1Qq
258,حلت الثوب انساب فوق عضاها,علي ويكا الجهاني,"حلت الثوب انساب فوق عضاها - شراب نين ورد خدها لماع
اصدار قابلت والريح ثاب معاها - تعرت وبان ذراعها شكاع
اوين ما رتاحت تم يقطر ماها - كما نبع يساكب بنو ارجاع

نهت طارها همت تريد ارداها - كنيب تحلف خوف مالبواع
رعت زول مداني قريب حذاها - غثيثها حدرها وطال جوف الذراع

والصبح غيب دورها كساها - قطع صحن معروضا علي بياع
سبحان موليا الي سواها - خرخوط صيتها بين الخلايق شاع ",مكتوبة كاملة,,,شعبي,AliWika.jpg,غير معروف,لا بأس,https://on.soundcloud.com/nzudT
259,دابين حى الشمس وانا واعى,علي ويكا الجهاني,دابين حي الشمس وانا واعي- وليا غربت يلفن عليا اوجاعي,مطلع الأغنية/رأس البيت فقط,على الجهانى,على الجهانى,شعبي,AliWika.jpg,غير معروف,لا بأس,https://on.soundcloud.com/vsNm4
260,دزيتلك مرسول وانتي دزى,علي ويكا الجهاني,دزيتلك مرسول وأنتي دزي - هات الدواء ولا تعالي عزي,مطلع الأغنية/رأس البيت فقط,جمعه بوخبينه,,شعبي,AliWika.jpg,غير معروف,لا بأس,https://on.soundcloud.com/WibmN
261,دمعك نزح ياعين ولا نسيتي,علي ويكا الجهاني,دمعك نزح ياعين ولا نسيتي - ولا تعبتي من البكاء مليتي,مطلع الأغنية/رأس البيت فقط,,,شعبي,AliWika.jpg,غير معروف,لا يوجد,
262,دوا داى ماتحجروها علي,علي ويكا الجهاني,دوا داى ماتحجروها علي - روفوا بها وبي - وماتشمتوا بعد الغلا الحساد فيا,مطلع الأغنية/رأس البيت فقط,,,شعبي,AliWika.jpg,غير معروف,رديء,
263,ريت زول فايق ع الغزال بصيفه,علي ويكا الجهاني,ريت زول فايق على الغزال بصيفه - يعجز لسان الحي فى توصيفه,مطلع الأغنية/رأس البيت فقط,,,شعبي,AliWika.jpg,غير معروف,لا بأس,https://on.soundcloud.com/3vQjv
264,ريت عين فى لريل الروح ذبلها,علي ويكا الجهاني,ريت عين فى لريل الروح ذبلها - سواد هدبها مطابق سواد خجلها,مطلع الأغنية/رأس البيت فقط,غلي الجهاني,,شعبي,AliWika.jpg,غير معروف,لا بأس,https://on.soundcloud.com/ZjaUY
265,سود الميامى كان ما داواني,علي ويكا الجهاني,سود الميامي كان ما داواني - وتو اللحايد وأيسو بريانى,مطلع الأغنية/رأس البيت فقط,,,شعبي,AliWika.jpg,غير معروف,لا بأس,https://on.soundcloud.com/5HaQc
266,شقت في الغلا واجد عرفت أنواعه,علي ويكا الجهاني,شقت قى الغلا واجد عرفت أنواعه - لقيته طريقه شوم لتباعه,مطلع الأغنية/رأس البيت فقط,السيد بومدين (شادي الجبل),,شعبي,AliWika.jpg,غير معروف,لا يوجد,
267,صابر وطاويه المرض فى كنينه,علي ويكا الجهاني,صابر وطاويه المرض فى كنينه - وفاقد قرينه - الخاطر مع الياس باقى جرينه,مطلع الأغنية/رأس البيت فقط,عمر جعودة,,شعبي,AliWika.jpg,1936,لا بأس,https://on.soundcloud.com/ctRbL
268,طال الليل والميزان غرب,علي ويكا الجهاني,طال الليل والميزان غرب - وغاب مناى لشبحه يطرب,مطلع الأغنية/رأس البيت فقط,على الجهانى,,شعبي,AliWika.jpg,غير معروف,رديء,
269,طواهن غلاك بشوق فيك يراجن,علي ويكا الجهاني,طواهن غلاك بشوق فيك يراجن - على عهدهن لانقضن لاراجن,مطلع الأغنية/رأس البيت فقط,,,شعبي,AliWika.jpg,غير معروف,لا بأس,https://on.soundcloud.com/KXaRA
270,عديت نقنص فى الغزالى بجودى,علي ويكا الجهاني,عديت نقنص فى الغزال بجودي - طاح الزناد وخانى بارودي,مطلع الأغنية/رأس البيت فقط,,,شعبي,AliWika.jpg,2000,لا بأس,https://on.soundcloud.com/Pp6ya
271,عيون ولفتى سبحان من ساطيهن,علي ويكا الجهاني,عيون ولفتى سبحان من ساطيهن - ياما منقرش م الهدوب وفيهن,مطلع الأغنية/رأس البيت فقط,,,شعبي,AliWika.jpg,غير معروف,لا بأس,https://on.soundcloud.com/4UeUk
272,غير ليش من بعد مادرتك منايا,علي ويكا الجهاني,غير ليش من بعد مادرتك منايا - وهديتك وفايا - تجفا تهون الود يناسى غلايا,مطلع الأغنية/رأس البيت فقط,على الجهانى,على الجهانى,شعبي,AliWika.jpg,غير معروف,لا يوجد,
273,فم الحوش قابلنى جبينه,علي ويكا الجهاني,"فم الحوش قابلنى جبينه - محكر فيه وغمزلى بعينه

يامن علو يامه من علاوى - حازن دون بوعرنيـــن ضاوى

ريما تاق خلفـــــــلى فجاوى - عن تقطيع قلبى موش ماوى",الكلمات غير مكتملة,,,شعبي,AliWika.jpg,غير معروف,لا بأس,https://on.soundcloud.com/PWpGK
274,قالولها راجل عدو ويجيكم,علي ويكا الجهاني,قالولــــــها راجل عدو ويجيكم - قالتلهم بسيف غصب عليكم,مطلع الأغنية/رأس البيت فقط,,,شعبي,AliWika.jpg,غير معروف,لا يوجد,
275,قد السجى ناير الخد ضاوى,علي ويكا الجهاني,قد السجى ناير الخد ضاوى - تقول بى ناوى - معاه قايدين خاشين القهاوى,مطلع الأغنية/رأس البيت فقط,,,شعبي,AliWika.jpg,غير معروف,لا بأس,https://on.soundcloud.com/eaJg8
276,كامى غلا بوخدود نقية,علي ويكا الجهاني,كامى غلا بوخدودا نقيه - شعل نار في - لاهان لابا يهاون على,مطلع الأغنية/رأس البيت فقط,,,شعبي,AliWika.jpg,غير معروف,لا بأس,https://on.soundcloud.com/6UqXj
277,كان درت من بعد العقالة زلة,علي ويكا الجهاني,كان درت من بعد العقالة زلة - إطيح من عيون الناس ماتعلة,مطلع الأغنية/رأس البيت فقط,هليل البيجو,,شعبي,AliWika.jpg,غير معروف,لا يوجد,
278,لا قسمت لا لوعة غلاك انسينا,علي ويكا الجهاني,لاقسمت لالوعة غلاك انسينا - وزاد الجظر حـرم النوم علينا,مطلع الأغنية/رأس البيت فقط,,,شعبي,AliWika.jpg,غير معروف,رديء,
279,سلف جناحك ليا,علي ويكا الجهاني,لو ياقطا تسلف جناحك ليا - بيك نوصل للى لاعني بلغيه,مطلع الأغنية/رأس البيت فقط,,,شعبي,AliWika.jpg,غير معروف,لا يوجد,
280,ليش تكذبى وانتي هواك بغيرى,علي ويكا الجهاني,ليش تكذبى ونتى هواك بغيرى - ياقاسية مايشغلك تفكيرى,مطلع الأغنية/رأس البيت فقط,,,شعبي,AliWika.jpg,غير معروف,لا بأس,https://on.soundcloud.com/gzp8N
281,ماباتن الانظار سهارى,علي ويكا الجهاني,ماباتن لنظار سهارى - يذارن بدموع غزاره,مطلع الأغنية/رأس البيت فقط,على الجهانى,على الجهانى,شعبي,AliWika.jpg,غير معروف,لا بأس,https://on.soundcloud.com/7LkwW
282,مانعودلك يالو حذاى بكيتي,علي ويكا الجهاني,مانعودلك يالو حذاى بكيتي - مانعاودك يلى معاى اخطيتى,مطلع الأغنية/رأس البيت فقط,,,شعبي,AliWika.jpg,غير معروف,لا بأس,https://on.soundcloud.com/w6G61
283,مرحب ياخرخوطة هلها,علي ويكا الجهاني,"مرحب ياخرخوطة هلها - يابنتاً سود نفايلها
ربي عالنسوان شهرها - بنتاً ماجيتي في جيل",الكلمات غير مكتملة,,,شعبي,AliWika.jpg,غير معروف,لا يوجد,
284,بعد طول غيابك يازينه ماجانى مرسول,علي ويكا الجهاني,من طول غيابك يازينه ماجانى مرسول - يشيل سلامى يريح قلبى والعقل المشغول,مطلع الأغنية/رأس البيت فقط,,,شعبي,AliWika.jpg,غير معروف,لا يوجد,
285,من يوم ريت الزين ماطلتش عوافي,علي ويكا الجهاني,من يوم ريت الزين ماطلتش عوافي - ولاكيل وافي - ناداى يالحباب مخفي خافي,مطلع الأغنية/رأس البيت فقط,,,شعبي,AliWika.jpg,غير معروف,رديء,
286,شالت العقل معاها,علي ويكا الجهاني,"موال
ناس واجده ترقد الليل - ونامانغفى دقيقه
ونا وين علم سهيل - عليا خطر حلو ريقه
أغنية
من دونهن شالت العقل معاها - هي بدر والباقي نجوم احداها",الكلمات غير مكتملة,على الجهانى,علي ويكا الجهاني,شعبي,AliWika.jpg,غير معروف,لا بأس,https://on.soundcloud.com/6BFnv
287,موش كل هالي تريدها تكسبها,علي ويكا الجهاني,"موش كل هالي تريدها تكسبها - ولا كل ضحكه وادك صاحبها

موش كل هالي اتريدها توصلها - ولا كل سمحت لون زين عملها
امواج البحر لو اتعد ما اتكملها - والشمس ما تزرق مع مغربها
ومحروق من جوا اللى قايلها - نار الغلا خزرة العين حطبها

موش كل هالي اتريدها واتريدك - ايواتن قساميها وتبقى ف يدك
مرات يا صاحب الدهر ايكيدك - والعين ديما تحت من حاجبها
دور على اللى تنفعك واتفيدك - والنفس وين اتعف ما تغصبها

موش كل هالي اتريدها تاجدها - وبرمة فلك الايام ما اتعاندها
بكره ثماير غرستك تحصدها - القاسمه للحي ما ايهلبها
اتجي بالسوا كيف ما الله رايدها - وموش كيف ظنك وين ما تاجدها

موش كل هالى اتريدها وتبيها - تجيك كان ما تسعالها واتجيها
اللى ساهله مرات توحل فيها - والصاعبه تسهل يزول تعبها
واللى اتعدها م الناس لوم عليها - وحاجه اتقل القدر ما تطلبها

موش كل هالى اتريدها اتلايمها - وعلة الغاوى الغاويه تفهمها
وفى الريق حنظل مر تستطعمها - تمويحة اللى خاطرك راغبها
والعين ع المعاصى كان ما تعصمها - تضلك ضلال كبير ما تغلبها
",وجب التأكد من اكتمال الكلمات,,,شعبي,AliWika.jpg,غير معروف,لا يوجد,
288,نا مواعدك ونتى على بطيتى,علي ويكا الجهاني,نا مواعدك ونتى على بطيتى - راجيت نحسابك تجى ماجيتى,مطلع الأغنية/رأس البيت فقط,,,شعبي,AliWika.jpg,غير معروف,لا بأس,https://on.soundcloud.com/TZbny
289,نا نزوم زومات الغديد بحمله,علي ويكا الجهاني,نانزوم زومات الغديد بحمله - ونانفرغك ياقلب ونته تمله,مطلع الأغنية/رأس البيت فقط,,,شعبي,AliWika.jpg,غير معروف,لا بأس,https://on.soundcloud.com/VPEk5
290,نرجوا فيك اطناشر هلال,علي ويكا الجهاني,نرجوا فيك اطناشر هلال - عمرك يوم ماقلتى تعال,مطلع الأغنية/رأس البيت فقط,,,شعبي,AliWika.jpg,1972,لا يوجد,
291,نزلتى وسلمتى عليا بيدك,علي ويكا الجهاني,نزلتى وسلمتى عليا بيدك - لقيتى الجفا ياقاسيا ميفيدك,مطلع الأغنية/رأس البيت فقط,,,شعبي,AliWika.jpg,غير معروف,لا يوجد,
292,نشيله فوق راسى ونور عينى,علي ويكا الجهاني,نشيله فوق راسى ونور عينى - ع الحساد ولى مايبينى,مطلع الأغنية/رأس البيت فقط,,,شعبي,AliWika.jpg,غير معروف,رديء,
293,نلقانى فى حال شينك غية,علي ويكا الجهاني,"نلقانى فى حال شينك غية - رقى سمها ع الكبد جار عليا

نلنقانى فى حاله - والروح عندى صايفا مذباله
والعين تذرى دمعها هياله - وين العرب ياخالقى ويش بيا

ياخالقى ويش داير.. سحن كبدتى مولى الوجيه الناير
غلاه جارفى جاشى دارمغاير - كــبر داى ماتنـــفع د باره ليا

مالقيت من داوانى - ولا لقيت من خاطر على بريانى
تميت ذايح والغرام خذانى - باقى مــطوح ع الفراش رميه",وجب التأكد من اكتمال الكلمات,,,شعبي,AliWika.jpg,غير معروف,لا بأس,https://on.soundcloud.com/pVZ56
294,نويت الجفا بالك تروق النية,علي ويكا الجهاني,نويت الجلا بالك تروق النية - وشطيت عن مدعى النسا والغية,مطلع الأغنية/رأس البيت فقط,,,شعبي,AliWika.jpg,1976,لا بأس,https://on.soundcloud.com/UmiBU
295,ويش قالك ياعين ويش قلتيله,علي ويكا الجهاني,ويش قالك يالعين ويش قلتيله - ريدك ضحك ونتى تبسمتيله,مطلع الأغنية/رأس البيت فقط,على الجهانى,,شعبي,AliWika.jpg,غير معروف,لا يوجد,
296,ياسك ياضاوى جبنونه,علي ويكا الجهاني,ياسك ياضاوى جبنونه - جور نين هلب قانونه,مطلع الأغنية/رأس البيت فقط,,,شعبي,AliWika.jpg,غير معروف,لا بأس,https://on.soundcloud.com/NyWtU
297,يا شوشان ما ريتش غزالي,علي ويكا الجهاني,ياشوشان ماريتش غزالى - خوذ المال ولبشاره حلالى,مطلع الأغنية/رأس البيت فقط,"سالم الزواوي، مصطفى حسين",,شعبي,AliWika.jpg,غير معروف,لا يوجد,
